{"baseline_receipts":[{"bytes":975,"path":"targets/erdos-64/evidence/receipts/baseline-pmw-frontier-choice-2026-08-14.json","sha256":"1418bffe1c1051028e16c1945609ae605923232af3b7b54ab90bead884bdb3f4"}],"budget_receipt":{"bytes":1420,"path":"targets/erdos-64/evidence/receipts/budget-pmw-frontier-choice-2026-08-14.json","sha256":"0fac77bb133bf3bd7bad19dd7f9059ebe388299b4c0e4cd760622024c6fd779b"},"problem_card_sha256":"a75b3beccdf71f86bc425cecfe1485b82e849174ca528abf2351a4915f51b4e9","problem_id":"erdos-64","red_team_receipt":{"bytes":739,"path":"targets/erdos-64/evidence/receipts/red-team-pmw-frontier-choice-2026-08-14.json","sha256":"28bd907a03156f793517b9e040da8369c8996b3a4c045a48982a225efbdb9a8f"},"review_receipts":[{"bytes":1109,"path":"targets/erdos-64/evidence/receipts/review-statement-pmw-frontier-choice-2026-08-14.json","sha256":"aae6858163d81afbb4ffe9395746cac717d936ed5252fb7792c86becfa9dbf82"},{"bytes":1106,"path":"targets/erdos-64/evidence/receipts/review-open-status-pmw-frontier-choice-2026-08-14.json","sha256":"3c28c3391f24643c9a5063649fe57465210e2cb2437ff8510298132ae451b4ec"}],"schema":"AMF_TARGET_BUNDLE_1","target_card":{"bytes":2206,"path":"targets/erdos-64/target-card.json","sha256":"106f5e6d4ad516a7eee5e38e43244769dc5254ce10d357505c90c853dc53fbcd"}}
