{"baseline_receipts":[{"bytes":1037,"path":"targets/degree-diameter-3-9-record/evidence/receipts/baseline-pmw-frontier-choice-2026-08-14.json","sha256":"622a33f3afc0a60d464bb6fb594e387d43ce57d14c4e6b6819c9c2395f737d10"}],"budget_receipt":{"bytes":1929,"path":"targets/degree-diameter-3-9-record/evidence/receipts/budget-pmw-frontier-choice-2026-08-14-provider-accounting-v2.json","sha256":"693fc2ca7c0993722d67d279139fdf85f80f41757d0e6a063bfdfc6eb9b1c622"},"problem_card_sha256":"ff24ae26ddc2206625a765c5a67ff9bc7c360c42f0067ac4c2cff5aa4444eb73","problem_id":"degree-diameter-3-9-record","red_team_receipt":{"bytes":781,"path":"targets/degree-diameter-3-9-record/evidence/receipts/red-team-pmw-frontier-choice-2026-08-14.json","sha256":"99389e6fcd026a48560f80c7ddc15628c408d9d465bf3cd56f5224f7ce373f69"},"review_receipts":[{"bytes":1191,"path":"targets/degree-diameter-3-9-record/evidence/receipts/review-statement-pmw-frontier-choice-2026-08-14.json","sha256":"87f1012121c2d20b506cc5c552eb6ce315a09d63ff79845e5f0ed69519b939e7"},{"bytes":1188,"path":"targets/degree-diameter-3-9-record/evidence/receipts/review-open-status-pmw-frontier-choice-2026-08-14.json","sha256":"a482e59492b391bd8698d1cc8a36a258572373c6f00dc5ba94a0aaf887afe992"}],"schema":"AMF_TARGET_BUNDLE_1","target_card":{"bytes":1889,"path":"targets/degree-diameter-3-9-record/target-card.json","sha256":"bdd8f93bcc0fac09eb2a06fff262525b96e92c86486acba50484cd7189d74391"}}
