{"baseline_receipts":[{"bytes":787,"path":"targets/frontier-stretched-lr/evidence/receipts/baseline-pmw-frontier-choice-2026-08-14.json","sha256":"d5491a5a7d08c52e4f6a4cc5bf67d8f0ce40219d997186c71ba7c02468c44136"}],"budget_receipt":{"bytes":1924,"path":"targets/frontier-stretched-lr/evidence/receipts/budget-pmw-frontier-choice-2026-08-14-provider-accounting-v2.json","sha256":"385bddd189fa6865d81ca0ce12e481133974f04b543f03d4833140df47bc0976"},"problem_card_sha256":"6d891e29afadbdc210962f87dc63add362ec2b1d5ee1a3de0886a70abef534c0","problem_id":"frontier-stretched-lr","red_team_receipt":{"bytes":774,"path":"targets/frontier-stretched-lr/evidence/receipts/red-team-pmw-frontier-choice-2026-08-14.json","sha256":"e4fa4b18d96695cc98aeb0b31e1f9ff4ac350c2eb44c1fe9be13f1c160894f82"},"review_receipts":[{"bytes":1162,"path":"targets/frontier-stretched-lr/evidence/receipts/review-statement-pmw-frontier-choice-2026-08-14.json","sha256":"0bf939172b8b6c58747be6e8861483c31d8107824d60c2702bd67735c531303a"},{"bytes":1159,"path":"targets/frontier-stretched-lr/evidence/receipts/review-open-status-pmw-frontier-choice-2026-08-14.json","sha256":"f0ba54e3ab15e575314a06f41a850f95a29ac751325d6ebb013a3f22151856ec"}],"schema":"AMF_TARGET_BUNDLE_1","target_card":{"bytes":2460,"path":"targets/frontier-stretched-lr/target-card.json","sha256":"1ab87748125aa10d24229cadc47c8d04a99add70aeb42465b8be8232b458aad8"}}
